<?xml version="1.0" encoding="UTF-8" ?>
<library desc = "This is the library of the institue"
    xmlns="https://ahmedsameh_lab2_task5"
    xmlns:xsi="http://www.w3.org/2001/XMLSchema-instance"
    xsi:schemaLocation="https://ahmedsameh_lab2_task5 librarySchema.xsd">

    <location>
        <city>cairo</city>
        <district>smart village</district>
    </location>
    <librarian id="1530">
        <firstName>Ahmed</firstName>
        <lastName>Sameh</lastName>
    </librarian>

    <books>
        <book>
            <title>clean code</title>
            <ISBN distribution="global">12345Ahmd13</ISBN>
            <author name ="Craftsman"/>
            <preface>
                <![CDATA["This book is for < boys & girls > 15 years]]>
            </preface>

            <sections>
                <chapter>
                    <title>functions</title>
                    <content>hello world</content>
                </chapter>
                <chapter>
                    <title>variables</title>
                    <content>hello world</content>
                </chapter>
            </sections>
        </book>

        <book>
            <title>OOP</title>
            <ISBN distribution="global">12345Ahmd13</ISBN>
            <author name ="AhmedSameh"/>
            <preface>
                <![CDATA["This book is for cracking interviews]]>
            </preface>

            <sections>
                <chapter>
                    <title>inheritance</title>
                    <content>hello world</content>
                </chapter>
                <chapter>
                    <title>polymorphism</title>
                    <content>hello world</content>
                </chapter>
            </sections>
        </book>

    </books>
</library>